{"$schema":"https://json-schema.org/draft/2020-12/schema","$id":"https://filmfoundry.dev/schemas/character-reference.v2.json","type":"object","additionalProperties":false,"required":["asset_id","reference_kind","face_closeup_asset_id","front_body_asset_id","back_body_asset_id","headless_body_strategy","state_variant","controls","does_not_control","qc_status"],"properties":{"asset_id":{"type":"string"},"reference_kind":{"type":"string"},"face_closeup_asset_id":{"type":"string"},"front_body_asset_id":{"type":"string"},"back_body_asset_id":{"type":"string"},"headless_body_strategy":{"enum":["NONE","OPTIONAL","REQUIRED_BY_ADAPTER"]},"state_variant":{"type":"string"},"parent_asset_id":{"type":["string","null"]},"mask_regions":{"type":"array"},"controls":{"type":"string"},"does_not_control":{"type":"string"},"qc_status":{"type":"string"},"extensions":{"type":"object"}}}
